{
  "version": 1,
  "license": "CC-BY-4.0",
  "note": "Carrier fees for US A2P 10DLC registration, USD, passed through at cost. Refresh with the weekly cost job.",
  "providers": [
    {
      "provider": "twilio",
      "last_verified": "2026-10-13",
      "source_url": "https://support.twilio.com/hc/en-us/articles/1260803965530",
      "person": { "brand_usd": "4.50", "campaign_vetting_usd": "15.00", "campaign_monthly_usd": "2.00" },
      "business": { "brand_usd": "46.00", "campaign_vetting_usd": "15.00", "campaign_monthly_usd": "10.00" }
    },
    {
      "provider": "telnyx",
      "last_verified": "2026-10-13",
      "source_url": "https://telnyx.com/pricing/messaging",
      "person": { "brand_usd": "4.50", "campaign_vetting_usd": "15.00", "campaign_monthly_usd": "2.00" },
      "business": { "brand_usd": "46.00", "campaign_vetting_usd": "15.00", "campaign_monthly_usd": "10.00" }
    }
  ]
}
